<?xml version="1.0" encoding="UTF-8"?>
<xs:schema xmlns:xs="http://www.w3.org/2001/XMLSchema">
    
    <xs:element name="heroes">
        <xs:complexType>
            <xs:sequence>
                <xs:element ref="hero" minOccurs="1" maxOccurs="unbounded"/>
            </xs:sequence>
        </xs:complexType>
    </xs:element>
    
    <xs:element name="hero">
        <xs:complexType>
            <xs:sequence>
                <xs:element name="name" minOccurs="1" maxOccurs="1"/>
                <xs:element ref="aliases" minOccurs="1" maxOccurs="1"/>
            </xs:sequence>
            <xs:attribute name="id" type="xs:int" use="required"/>
        </xs:complexType>
    </xs:element>
    
    <xs:element name="aliases">
        <xs:complexType>
            <xs:sequence>
                <xs:element name="alias" minOccurs="1" maxOccurs="unbounded"/>
            </xs:sequence>
        </xs:complexType>
    </xs:element>
    
   
</xs:schema>
